name,rating,total_reviews,price,buyers
"100% Compostable Paper Plates, Heavy Duty Disposable Plates [125-Pack] 9 Inch Plates - Eco-Friendly, Biodegradable Sugarcane Bagasse, Natural Unbleached Brown 9"" Dinner Paper Plate Disposable",4.7,22163,21,10000
"Paper Plates, 100% Compostable Heavy Duty Disposable 10 Inch Plate - [125-Pack] - {PFAS-Free} - {BPI Certified} Eco-Friendly, Biodegradable Bagasse",4.7,3937,26,5000
"Paper Plates, 100% Compostable Heavy Duty, Disposable 7 Inch, Small Dessert Plate - [125-Pack] - {PFAS-Free} - {BPI Certified} Eco-Friendly, Biodegradable Bagasse Natural Brown 7"" Small Plates",4.6,8097,16,5000
Vplus 150 Pack Compostable Disposable Paper Plates 10.25 inch Super Strong Paper Plates 100% Bagasse Natural Biodegradable Eco-Friendly Sugarcane Plates(white),4.7,1915,25,3000
Palm Leaf Plates Bamboo Paper Plates Disposable 10 Inch & 7 Inch Bulk Party Pack Eco Compostable Biodegradable Wooden Plates Best Alternative To Plastic Paper Plates (50 pc),4.5,207,25,1000
"ECOLipak 100% Compostable 10 inch Paper Plates, 150 Pack Heavy Duty Paper Plates, Disposable Biodegradable Eco-friendly Sugarcane Bagasse Plates for Dinner Party(White)",4.6,1358,28,1000
Vplus 150 Pack Paper Plates 9 inch 100% Compostable Plates Heavy-Duty Disposable Paper Plates Bagasse Natural Biodegradable Eco-Friendly Sugarcane Plates,4.7,864,23,1000
"Comfy Package [9 Inch - 125 Pack Heavy-Duty White Paper Plates, 100% Compostable, Eco-Friendly - Biodegradable Disposable Plates, Sugarcane Paper Plates",4.7,9308,22,1000
"Hefty ECOSAVE Compostable Thanksgiving Paper Plates, 10-1/8 Inch, 45 Count",4.6,3235,7,900+
"ECO SOUL 100% Compostable 6 Inch Small Paper Plates (100-Pack) Disposable Party Heavy Duty, Eco-Friendly, Appetizer, Dessert, Wedding Plates I Biodegradable Unbleached Sugarcane Eco Plates",4.6,1901,16,1000
100% Compostable Paper Plates [9 in.] – 150 Disposable Plates Eco Friendly Sturdy Tree Free Liquid and Heat Resistant Alternative to Plastic or Paper Plates,4.6,385,36,1000
"ECOLipak 120 Pack Compostable Paper Plates, 10 inch and 8 inch Heavy Duty Disposable Square Plates, Eco friendly Sugarcane Biodegradable Plates for Party Dinner Birthday",4.7,540,29,600+
"Comfy Package [9 Inch - 125 Pack Paper Plates, 100% Compostable Plates Heavy-Duty - Kraft Biodegradable Plates, Disposable Sugarcane Paper Plates - Brown Unbleached",4.7,3240,20,900+
"150 Pieces 100% Compostable 10"""" Paper Plates, 3 Compartments Heavy Duty Disposable Plates, Eco Friendly Combo Plates, Biodegradable Dividers Made of Sugarcane Fiber (10"""")",4.6,40,21,400+
"ECOLipak 150 Piecs Compostable Square Plates, 6-inch Disposable Paper Plates, Eco-friendly Heavy Duty Biodegradable Sugarcane Plates for Party Dinner Birthday",4.7,697,22,500+
"10 * 8 inch Small 5 Compartment Paper Plates [125-Pack], Disposable Heavy Duty Birthday Party Trays, Compostable Eco Bagasse Plates for Light Snacks",4.7,313,24,300+
Gezond Compostable Paper Plates Set 300pcs Disposable Sugarcane Plates 10 Inch Eco-friendly White Square Plates with Napkins Biodegradable Heavy-duty Utensils for Party,4.8,135,30,300+
"Paper Plates 10 Inch [125 Count], 100% Compostable Disposable Plates Heavy Duty, Made of Bagasse Biodegradable Eco-Friendly Paper Plates Bulk for Party, Wedding, Dinner, BBQ (White)",4.7,568,24,300+
"Palm Leaf Plates 10 Inch Bamboo Paper Plates Disposable 50 Bulk Dinner Square Party Plates Event Tableware Eco Biodegradable Compostable Wooden Plates Best Alternative to Plastic Plates, By KoalaLove",4.6,126,28,400+
"Jeopace Heavy Duty Paper Plates Set for Dinner,Disposable Paper Plates Set Eco Friendly,Sugarcane Bagasse 9 Inch and 7 Inch Party Plates,Forks,Knives and Spoons Set for 50 People [250 PCS]",4.6,1078,26,200+
"Dixie EcoSmart 100% Recycled Fiber Paper Plates, 8.5in, 50 Count, Medium Disposable Plate Great for Light Breakfast, Lunch, and Dinner Size",4.5,1517,9,300+
"150 Pieces 100% Compostable Paper Plates (White 7inch) Heavy Duty Disposable Plates Eco Plates Made of Sugarcane Fiber Biodegradable Plates for Everyday Dinner, Party, Barbecue",4.6,64,19,200+
ECOLipak 125 Pack Paper Plates 10 inch 100% Compostable Plates Heavy-Duty Dinner Plates Disposable Bagasse Deep Dish Natural Biodegradable Eco-Friendly Sugarcane Plates(Brown),4.9,93,20,200+
JOLLY CHEF Compostable Heavy Duty Plates 10 Inch [125 Pack] Eco-Friendly Disposable Paper Plates Made of Bagasse Biodegradable Plates Bulk for Party Dinner Sugarcane Fibers Round Plates(Natural),4.7,351,16,300+
"Dixie EcoSmart 100% Recycled Fiber Paper Plates, 10 in, 144 Count (Pack of 4), Large Disposable Plate Great for Breakfast, Lunch, and Dinner Meals",4.5,276,27,300+
"Dtocs Palm Leaf Plates Set (50) - 10 Inch Square Dinner Plates (25), 7"" Dessert (25) | Bamboo Plates Disposable look Compostable Plates Dinnerware | Sturdy Biodegradable Plates than Fancy Paper Plates",4.5,143,32,100+
"Disposable Plates, Sturdy and Durable Compostable Paper Plates - Heavy Duty, Eco-Friendly, Biodegradable, Unbleached, Sugarcane Bagasse Dinner Plate, 125-Pack 9 Inch",4.7,154,20,100+
Palm Leaf Plates Bamboo Paper Plates Disposable 6 Inch 100 Bulk Appetizer and Dessert Square Plates Party Pack Eco Biodegradable Compostable Wooden Plates Better Than Plastic Plates By KoalaLove,4.5,181,47,100+
"SOLO Bare Eco-Forward 9 Inch Plant-Based Sugarcane Fiber Round Divided Plate, (4 Packs of 125, 500 Plates Total), Solo Cup Company Eco-Friendly Disposable Paper Plates Alternative",4.6,47,45,200+
"Compostable Party Paper Plates Set -[300 Pcs] 10 inch&8 inch Square Brown Paper Plates Heavy Duty, Utensils and Napkins - Eco Friendly Disposable Plates for Party",4.8,98,34,100+
100% Compostable Paper Plates [7 in.] – 150 Disposable Plates Eco Friendly Sturdy Tree Free Liquid and Heat Resistant Alternative to Plastic or Paper Plates,4.6,222,27,200+
"Compostable Disposable Paper Plates Set -[300 Pcs]10 inch 8 inch Heavy Duty Biodegradable Square Plates and Spoons,Forks,Knives,Napkins-Eco-Friendly Party Bulk",4.6,368,33,100+
"EconoHome 12 Inch Compostable Paper Plates [50-Pack] - Eco-Conscious Disposable Tray Made of Bagasse or Sugarcane Fiber - Microwave, Refrigerator-Safe - Heavy Duty Paper Plates for Dinner",4.7,277,22,100+
"6 Inch Compostable Plates 100 Pack Heavy Duty Compostable Paper Plates, Eco-Friendly Sugarcane Bagasse Plates, Natural Brown, Ideal for Dinners, Events, and Weddings",4.6,197,13,100+
"SOL ECO Compostable Paper Plates, 400 PCS Heavy-Duty Compostable Plates, Party Paper Plates & bowls (10 inch & 20 oz) Forks, Knives, Spoons, Cups & Napkins for Party, 50 Guest",4.3,130,47,100+
"ECO SOUL 200 Pcs Compostable Dinnerware Set For 25 Guests, 25 Pcs Each Of Eco-Friendly Disposable Paper Plates Of 9"""" & 6"""", Cutlery, Napkins, 16 oz Bowls & 16 oz Cups For Party, Picnic & Gathering",4.8,59,23,50+
"Paper Plates 9 Inches, 100 Pack Disposable Plates For Party – 100% Compostable Plates, Water & Oil Proof Paper Plates, Microwavable Paper Plates Bulk - Brown",4.5,214,17,100+
"ECOLipak Paper Plates 10 Inch, 150 Pack 100% Compostable Plates Heavy Duty Disposable Biodegradable Plates Sugarcane Bagasse Eco Friendly Plates",4.7,36,18,100+
brheez Palm Leaf Party Plates 25 Ct 6 Inch Eco Friendly Compostable & Biodegradable – Elegant Bamboo Look Disposable Party Plates Heavy Duty Environmentally Friendlier than Paper Plates,4.5,1597,15,50+
"Disposable Compostable Paper Plates 6 Inch [125-Pack], Heavy Duty, Eco-Friendly made with Biodegradable Bagasse for Parties and Picinic, (Eco-White)",4.5,96,14,100+
"Paper Plates 6 inch, 50 Pack Small Paper Plates, Eco Friendly Disposable Plates Made of Sugarcane Fibers, 100% Compostable Paper Plates, Dessert Paper Plates, Brown",4.7,279,9,50+
"Paper Compostable Plates - 7 Inch Heavy Duty Paper Plates, 50-Pack of Biodegradable Plates from Sugarcane - Disposable Dessert Plates, Thick Paper Plates Bulk",4.6,298,6,50+
"ECO SOUL Compostable 8 Inch Palm Leaf Square Plates (200 Count) Like Bamboo Plates | Biodegradable | Eco-Friendly, Microwave & Oven Safe",4.5,1920,77,50+
"Small Paper Plates 6 inch, 200 Pack Disposable Paper Plates, Eco Friendly Compostable Dessert Plates, Sugarcane Biodegradable Plates, Brown Paper Plates Bulk",4.5,93,23,50+
"Dixie EcoSmart 100% Recycled Fiber Paper Plates, 10 in, 36 Count, Medium Disposable Plate Great for Light Breakfast, Lunch, and Dinner Size",4.5,136,9,50+
"EconoHome 50 Pack Disposable Plates with 3 Compartments - Eco-Conscious Bagasse Sugarcane Disposable Plates - Microwave, Refrigerator-Safe - Heavy Duty Paper Plates for Dinner Party Supplies",4.5,125,20,50+
100% Compostable Paper Plates [9 in.] COMPARTMENTS – 150 Disposable Plates Eco Friendly Sturdy Tree Free Liquid and Heat Resistant Alternative to Plastic or Paper Plates,4.4,123,38,50+
"100% Compostable Disposable Paper Plates Bulk [9"" 50 Pack], Bamboo Plates, Eco Friendly, Biodegradable, Sturdy Large Dinner Party Plates, Heavy-Duty, Unbleached by Earth's Natural Alternative",4.7,10635,13,N/A
JOLLY CHEF Compostable Heavy Duty Plates 10 Inch [100 Pack] Eco-Friendly Disposable Natural Paper Plates Bagasse Biodegradable Plates Bulk for Party Dinner Sugarcane Fibers Round Plates(Brown),4.7,234,22,100+
"Paper Plates, 100% Compostable Heavy Duty, Disposable 7 Inch, Small Dessert Plate - [125-Pack] - {PFAS-Free} - {BPI Certified} Eco-Friendly, Biodegradable Bagasse Natural Brown 7"" Small Plates",4.6,8097,16,5000
"250 Piece Biodegradable Paper Plates Set (EXTRA LONG UTENSILS), Disposable Dinnerware Set, Eco Friendly Compostable Plates & Utensil include Plates, Forks, Knives and Spoons for Party",4.6,1754,32,800+
"Chic Leaf Palm Leaf Disposable Plates - Bamboo Plates Disposable 10 Inch & 7 Inch Square (48 pc) Compostable & Biodegradable, Better than Plastic Plates - Heavy-Duty, Party Plates Dinnerware Set",4.5,2112,34,4000
ECO SOUL Pearl White 9 Inch [100-Pack] Paper Plates (PFAS free) | 100% Compostable Disposable Bagasse I Heavy Duty Eco-Friendly Dinner Plates I Biodegradable Sugarcane Eco Plates | Microwavable,4.4,245,15,100+
"Raj Eco Compostable Palm Leaf Plates Like Bamboo Plates Disposable - 10 Inch Square 50 Party Plates, Natural Wooden, Eco-Friendly, Fancy Biodegradable & Disposable Wedding Picnic Plates",4.5,231,27,N/A
"ECOLipak 350 Pack Compostable Paper Plates Set, Heavy Duty Biodegradable Plates Set & Eco Friendly CPLA Cutlery, Disposable Dinnerware Set for Party Camping Birthday BBQ",4.7,432,29,50+
"Disposable Compostable Paper Plates 9 Inch [125-Pack], Heavy Duty, Eco-Friendly made with Biodegradable Bagasse for Parties and Picinic, (Natural-Brown)",4.6,56,21,50+
"ECO SOUL 100% Compostable, Disposable Bagasse Paper Plates | (125 Count, 10"" Round Plates, 3 Compartment) | Eco-friendly Dinner Plates | Sturdy, Microwave & Oven Safe | Party, Wedding, Event Plate",4.4,75,21,N/A
"Raj Eco Compostable Palm Leaf Plates Like Bamboo Plates Disposable - 4 Inch Square 100 Party Plates, Natural Wooden, Eco-Friendly, Fancy Biodegradable & Disposable Wedding Picnic Plates",4.4,33,26,N/A
"Compostable Bamboo Disposable Plates 5 Compartments, 50 Pack - Heavy Duty, Microwavable, Oven Safe - Divided Tray for Meals, Lunch - Eco-Friendly, Biodegradable (Style 1)",4.3,111,39,50+
Palm Leaf Plates Bamboo Paper Plates Disposable 10 Inch & 6 Inch Bulk Party Pack Eco Compostable Biodegradable Wooden Plates Best Alternative To Plastic Paper Plates (100 pc),4.3,127,55,N/A
"Dhaey Compostable Plates 7 inch, 50pcs Biodegradable Dinnerware Compostable Paper Plate, biodegradable paper plate, Natural round disposable baggase plate for Party Microwave Safe Eco Plates Utensils",4.7,17,8,N/A
| 10 inch & 6 inch & 3 inch Combo Plates 75 pcs | Disposable Plates | Like Bamboo plates | Palm leaf Plates for Dinner | Compostable Plates | Picnic Party Plates better than Paper Plates,4.6,26,29,N/A
GREEN SAHARA 6 Inch Paper Plates [100-Pack] Disposable Party Plates I Heavy Duty Eco-Friendly Paper Pulp Plates I 100% compostable Biodegradable Sugarcane Eco Plates,5.0,1,6,N/A
"SUGARFIBER 10-inch Compostable Disposable Paper Plates, White Floral Acanthus Collection [100 COUNT]",4.7,605,29,N/A
"100% Compostable Paper Plates 7 Inch 150 Pcs Disposable Heavy-Duty Plates Eco-Friendly Natural Sugarcane Bagasse Fiber Biodegradable for BBQ,Party,Picnic Etc",5.0,10,12,50+
SOLAS Christmas Paper Plates - Festive Disposable Christmas Tree Paper Plates - Biodegradable & Fully Compostable Holiday Party Paper Plates - Pack of 20 x 9 Inch Christmas Paper Dinner Plates,4.7,189,11,N/A
"ECO SOUL 15 cm (6 Inch Small), 100 Pack Disposable Bagasse Plates | Eco-friendly, Biodegradable, Sugarcane Paper Plates | For Serving Snacks & Dinner | Birthday, Wedding & Party | Square, White",4.7,212,13,N/A
"40 10"" Square Palm Leaf Plates + 80 Cutlery or Wood Plates. Heavy Duty, 100% Compostable & Biodegradable Eco Friendly Party Plates (10 inch palm leaf plates)",4.7,1134,31,N/A
"Sophistiplate Eco-Friendly Compostable Dinner Plates - Made of Bamboo Wood Fiber, and Sugarcane- Biodegradable and Disposable Party Plates- Sturdy & Heavy Duty - Pack of 16",4.5,43,24,N/A
"Disposable plates 10inch square plates 16cm fork and knife 50pcs Palm Leaf plates better than plastic plates Eco-Friendlye Like Bamboo Wood Plates Party,Wedding,Event Plate Pack of 150",5.0,2,24,N/A
"Talking Tables 8 x Safari Animal Themed Paper Plates for Girls & Boys Birthday or Baby Shower | Jungle Zoo, Madagascar Friendly Disposable Dishes for Kids Eco Choice",4.6,87,7,N/A
ECO SOUL 100% Compostable 10 Inch Paper Plates [1000-Pack] Disposable party plates I Heavy duty Eco-friendly Desert plates Disposable I Biodegradable Unbleached sugarcane Eco plates,3.7,3,123,N/A
"Dtocs Palm Leaf Plates Set (50 Pcs) Oval Plates 7x5 Inch | Bamboo Plates Disposable Like Compostable Decorative Dinnerware Sturdy than Paper Plates | Designer Plates for Serving Dessert, Cake, Salad",4.5,45,27,N/A
"100% Paper Plate,Compostable,Recyclable,Disposable,(9-inch),(40-pack),for Party,Birthday,BBQ,Camping., large, White",N/A,N/A,5,N/A
"40 PCS 10"" Square Palm Leaf Plates Like Bamboo Plates Disposable Eco Friendly 100% Natural Leaf Plates Compostable Appetizer Plates Disposable Perfect for Parties, Sustainable Events",4.6,100,29,N/A
"Raj Eco Compostable Palm Leaf Plates Like Bamboo Plates Disposable - 8 Inch Square 25 party plates, Natural wooden, Eco-Friendly, fancy Biodegradable & Disposable Dessert appetizer Plates",4.8,146,15,N/A
"9-Inch Disposable Paper Plates - 300 Count - Bulk Pack of Uncoated Paper Plates for Everyday Use - Dinnerware for Meals, Parties And Picnics",4.1,39,20,N/A
"Dtocs Palm Leaf Plates (50), 9"" Round | Bamboo Plates Disposable Like Eco-friendly Compostable Party Plates For Wedding, Camping, Birthday Dinner | Serving Platters Sturdy than Paper Plates",4.6,31,29,N/A
"Paper Plates, Compostable Heavy Duty Disposable 9 Inch Plates - Eco-Friendly, Biodegradable Sugarcane Bagasse, Natural Unbleached Brown 9"" Dinner Paper Plate Disposable (9inc-200Pack)",5.0,344,31,N/A
"ECO PRODUCTS Compostable Vanguard 9"" Paper Plates, Case of 500, Disposable White Molded Fiber, Round, Tree-Free, Stronger Than Paper & Styrofoam, No-Added PFAS, ASTM Compliant, BPI-Certified",N/A,N/A,85,N/A
ECO SOUL Pearl White 6 Inch Small Square 200 [2x100 Pc] Paper Plates (PFAS free) | 100% Compostable Disposable Bagasse I Heavy-Duty Eco-Friendly Dinner Plates I Biodegradable Sugarcane Eco Plates,4.4,11,20,N/A
"SOLO Bare Eco-Forward 9 Inch Plant-Based Sugarcane Fiber Round Plate, (4 Packs of 125, 500 Plates Total), Solo Cup Company Eco-Friendly Disposable Paper Plates Alternative",4.6,72,43,N/A
"300Pcs Compostable Paper Plates Set, Eco-friendly Heavy Duty Plates & Biodegradable Utensil Include Forks,Knives,Spoons, Napkins, Disposable Dinnerware Set for Party (Brown)",4.6,190,29,N/A
Palm Leaf Plates Bamboo Paper Plates Disposable 10 Inch & 7 Inch Bulk Party Pack Eco Compostable Biodegradable Wooden Plates Best Alternative To Plastic Paper Plates (20 pc),4.8,6,15,N/A
"ECO SOUL Compostable 6 Inch Small Palm Leaf Round Plates (400, 6"" Square Plates)",4.4,213,109,N/A
"ECO PRODUCTS Compostable 9"" Paper Plates, Case of 500, Disposable White Molded Fiber, Round, Tree-Free, Stronger Than Paper & Styrofoam, Renewable Molded Natural Fibers",4.4,33,75,N/A
"Dtocs Palm Leaf Plates 6 Inch Round (50) | Bamboo Plates Disposable Look Cocktail Plates for Appetizers, Dessert Plates, Mini Charcuterie Boards | Compostable Plates Alternate to Paper Plates 6 Inch",4.8,11,25,N/A
"Paper Plates - 8 Inch Biodegradable, Heavy Duty, Microwave Safe Square Disposable Plates, Soak & Cut Resistant, Eco-Friendly, 150-Pack",4.5,143,17,N/A
"Comfy Package [Case of 500] 9 Inch Paper Plates, 100% Compostable Plates Heavy-Duty - Kraft Biodegradable Plates, Disposable Sugarcane Paper Plates - Brown Unbleached",N/A,N/A,57,N/A
"Disposable 3 Compartment Paper Plates, 100% Compostable, 125 Count, Heavy Duty, Leakproof, Microwave Safe, 10 Inch, Off-White",5.0,1,25,N/A
"Square Palm Leaf Plates Set (Pack of 25) | Salad Plates | Ecofriendly Disposable Dinnerware | Heavy Duty Biodegradable Party Utensils for Wedding, Camping & More",4.6,689,11,N/A
"Paper Plates Disposable 9 Inch 100% Compostable Heavy Duty[125-Pack],Eco Biodegradable White Dinner & Lunch Plates,Family Birthday Party Holiday Plates,Made of Natural Sugarcane Fibers.",4.5,4,16,N/A
"ECO SOUL 100% Compostable, Disposable Bagasse Paper Plates | Heavy-Duty Eco-friendly Dinner Plates | Sturdy, Microwave & Oven Safe | Party, Wedding, Event Plates (20 Count, 9"" Round Plates)",5.0,1,9,N/A
"300PCS Compostable Paper Plates Set, Biodegradable Heavy Duty Disposable Sugarcane Plates Utensils Dinnerware for Party Camping Picnic",4.7,138,29,N/A
"Compostable Paper Plates 14 Inch: 100 Pack Heavy Duty Paper Plates, Natural Unbleached Sugarcane Bagasse Disposable Plates for Party, Wedding",5.0,100,31,N/A
"Sophistiplate Beautiful NEW Wavy Eco-Friendly Compostable Party Plates - Made of Bamboo Wood Fiber, and Sugarcane- biodegradable - 9.5 In, Sturdy & Heavy Duty - Pack of 8, Color Sky Blue",5.0,2,13,N/A
9 Inch Round Paper Plates - 100% Compostable - Heavy Duty - (125 pack) - Bagasse Plates - Fully Biodegradable - Environmental-Friendly - Sugarcane Pulp Material,4.0,1,12,N/A
"Dtocs 3 Compartment Plates (50 Pc) Palm Leaf Plates10 Inch Round Portion Control Plate | Bamboo Plates Disposable Like Sectional Plates Stronger than Divided Paper Plates, Buffet Styrofoam Plates",3.9,14,35,N/A
"100% Compostable 9 inch Paper Plates [150-Pack], Heavy-Duty Disposable, Eco-Friendly Party Plates, Biodegradable Dinner Plates, Natural Brown Sugarcane Bagasse Plates (150)",5.0,3,15,N/A
"Heavyweights Paper Plates, White",4.3,33,19,N/A
"100% Compostable Oval Paper Plates [50-Pack] - {PFAS-Free} - {BPI Certified} - [12 Inch] Heavy Duty, Eco-Friendly, Biodegradable Bagasse Platters - Natural Brown 12"" Oval Platter Plates by Stack Man",4.7,5983,20,6000
Vplus 150 Pack Compostable Disposable Paper Plates 10.25 inch Super Strong Paper Plates 100% Bagasse Natural Biodegradable Eco-Friendly Sugarcane Plates(white),4.7,1915,25,3000
"100% Compostable Disposable Paper Plates [125-Pack] - {PFAS-Free} - {BPI Certified} - [7 Inch] Heavy Duty, Eco-Friendly, Biodegradable Bagasse Dinner & Lunch Plates - Thick White 7"" Plate by Stack Man",4.5,1804,16,1000
"100% Compostable 10 Inch Heavy-Duty [125-Pack] Eco-Friendly Disposable White Bagasse Plate, Made of Natural Sugarcane Fibers - 10"" Biodegradable Paper Plates by Stack Man",N/A,N/A,26,2000
9 Inch Round Paper Plates - 100% Compostable - Heavy Duty - (125 pack) - Bagasse Plates - Fully Biodegradable - Environmental-Friendly - Sugarcane Pulp Material,4.0,1,12,N/A
"Heavyweights Paper Plates, White",4.3,33,19,N/A
"400PCS Compostable Paper Plates Set, Disposable Eco-friendly Dinnerware Set, Biodegradable Heavy-Duty Paper Plates, Utensils, Cups and Straws for Party Camping 50 (White)",4.7,117,39,N/A
"Talking Tables 8 x Safari Animal Themed Paper Plates for Girls & Boys Birthday or Baby Shower | Jungle Zoo, Madagascar Eco-Friendly Disposable Dishes for Kids Eco Choice",3.0,2,8,N/A
50-Pack 10” Square Palm Leaf Plates - Premium Eco-Friendly Disposable Dinnerware,4.6,26,33,N/A
"Efavormart 24 Pack | White 7"" Round Geometric Gold Rim Leaf Salad Paper Plates, Disposable Plates With Eucalyptus Print - 300 GSM",4.0,3,5,N/A
"6 Inch Disposable Bamboo Paper Plates - 125 Pack Heavy Duty, Biodegradable, Compostable Large Serving Plate for Dinner, Party - Bulk Pack with Microwavable, White",N/A,N/A,12,N/A
"Antimbee Disposable Plates 9 inch (130 Pack), Heavy Duty Paper Plates Bulk, Microwavable Renewable Bamboo Pulp Paper Plate for Home, Party, Wedding, Holiday Meal",4.5,10,9,N/A
"Disposable Paper Plates Set 250 Pcs, 100% Compostable Heavy Duty Paper Plate 7 Inch and 10 Inch, Includes Eco Forks, Knives and Spoons for 50 Guests",5.0,6,22,N/A
"Pumpkin Orange Round Disposable Dessert Paper Plates - 7'', 8 Pieces - Perfect for Parties, Weddings, Holidays & Events",4.4,948,6,N/A
Patra 50 pcs - 9 Inch square Palm Leaf Plates Disposable Eco Friendly Biodegradable Compostable Like Bamboo Plates - Superior to Paper and Plastic Plates (50 counts),4.2,15,29,N/A
125 Pack Compostable Disposable Paper Plates 9 Inch Heavy-Duty 100% Bagasse Natural Biodegradable Eco-Friendly Sugarcane Plates,4.5,91,20,N/A
"Sparkling Celebration ""80"" Round Prismatic Plates, 7"" (Pack of 8) - Black, Silver & Gold Birthday Party Plates, Perfect for Memorable Occasions & Events",4.4,161,6,N/A
"9 Inch Disposable Bamboo Paper Plates - 50 Pack Heavy Duty, Biodegradable, Compostable Large Serving Plate for Dinner, Party - Bulk Pack with Microwavable, White",N/A,N/A,12,N/A
"Dtocs Palm Leaf Plates 7x11 Inch Rectangle Plates (Pack 100) | Bamboo Trays Look Compostable Disposable Cookie Trays, Platters, Mini Charcuterie Boards | Alternate to Paper Plates",3.4,5,62,N/A
NYHI Heavy Duty Plates 7 Inch Disposable Plates For Adults Kids Brown Eco Friendly Sugarcane Paper Plates Are Cut Leak Resistant 125 Pack 7 INCH,4.7,78,19,N/A
"ECO PRODUCTS Disposable Square Sugarcane Plate, Eco-Friendly, Compostable, Grease and Cut Resistant, Microwave Safe, 10"" x 10"", Case of 250",4.3,54,85,N/A
"ECO PRODUCTS Compostable 6"" Paper Plates, Case of 1000, Disposable White Molded Fiber, Round, Tree-Free, Stronger Than Paper & Styrofoam, Renewable Molded Natural Fibers",4.3,17,76,N/A
100% Compostable 9 Inch Paper Plates [125-Pack] Disposable Party Plates I Heavy Duty Eco-Friendly Dinner Plates Disposable I Biodegradable Unbleached Sugarcane Eco Plates,4.8,21,14,N/A
"Disposable Palm Bamboo Plates Ecofriendly Heavy Duty (50 Pack, 8"" Square)",4.6,574,32,N/A
"Royal Blue Round Dessert Paper Plates - 6 7/8 in (Pack of 16) - Eco-Friendly & Disposable Tableware - Perfect for Celebrations, Weddings & Gatherings",4.0,55,6,N/A
"Amscan Floral Sweet Baby Girl Round Plates, 7"" (8-Pack) - Charming Party Tableware with Blossom Design, Perfect for Showers & Special Celebrations",4.2,7,3,N/A
"SOLO Bare Eco-Forward Sugarcane Dinnerware, Plate, 6.7"" Dia, Ivory, 125/pack",N/A,N/A,26,N/A
"Dtocs Palm Leaf Plates (50) Oval Plate Set | 10 Inch Large Oval Trays (25), 7"" Small Oval Plates (25) | Bamboo Plates Disposable Like Compostable Picnic Plates BBQ Platters Sturdy than Paper Plates",4.8,21,30,N/A
"SIMOND STORE - 7 Inch Compostable Square Plates - [Pack of 100] Heavy Duty Biodegradable Paper Plates - Made of Sugarcane Bagasse Fiber - Disposable Paper Plates for Party, BBQ, Wedding",N/A,N/A,15,N/A
"100% Compostable Natural Plant Fiber Plate, 6-Inch, 1000-Count Case",4.3,68,84,N/A
"Pack of 12 Colourful Star Paper Plates | Rainbow Party Supplies, Home Recyclable, Eco-Friendly, Unisex | Disposable Tableware for Kids Birthdays, Garden Picnic, BBQ, Crafting",3.5,10,6,N/A
"Hot Wheels Wild Racer Round Plates (9"", Pack of 8) - Vibrant Multicolor Paper Party Plates - Ideal for Kids Birthday or Hot Wheels Themed Celebrations",4.7,218,8,N/A
"Ecoplates [50 Pack] 9-Inch Paper Plates 100% Compostable - Made from Sugarcane Fiber-Biodegradable-Disposable-PFAS Free-Natural White-Heavy-Duty Bagasse Party Dinner Plate., ECO-P09-50",5.0,1,11,N/A
"Verde Planet - 12 inch Oval Bagasse Plates - Biodegradable, Tree Free Sugarcane Fiber, Ecofriendly, Disposable, Sturdy, White Premium Quality Plates - 125 Count",4.0,49,36,N/A
"Holiday Party Dinnerware Eco Set of 300 Eco-Friendly Dinnerware - 100 Disposable 8"" Square Palm Leaf Plates, 100 Wood Forks, 100 Wood Knives",4.7,447,62,N/A
"Dtocs Bamboo Plate Disposable Like 10"" Oval Palm Leaf Plates [50] - Compostable Trays, Serving Platters, Charcuterie Dinnerware Set for Wedding Parties | Elegant than Plastic, Paper Plates",4.7,9,31,N/A
"Juvale 48-Pack Kraft Gold Foil Dots 9 Inch Paper Party Plates for Lunch, Dessert, or Appetizer",3.6,16,10,N/A
"Efavormart 24 Pack | 9"" White Round Dinner Paper Plates, Disposable Plates with Geometric Eucalyptus and Gold Rim Design - 300 GSM",4.6,21,6,N/A
"TCC - Mini Individual Palm Leaf Condiment Cups, 2,5"" round, 100 pcs. Bamboo & Wood Style, Biodegradable, Single Use, Disposable, Usable for Hot Dishes",4.9,16,19,N/A
Palm Leaf Plates Bamboo Paper Plates Disposable 10 Inch & 6 Inch Bulk Party Pack Eco Compostable Biodegradable Wooden Plates Best Alternative To Plastic Paper Plates (20 pc),4.7,4,15,N/A
"Premium 9 Inch Round White Paper Plates [50-Pack] -100% Compostable & Eco-Friendly Disposable, Heavy Duty, PFAS-Free, Made of Sugarcane Bagasse (9"" Round Plates)",4.5,9,12,N/A
"6 Inch Disposable Bamboo Paper Plates - 60 Pack Heavy Duty, Biodegradable, Compostable Large Serving Plate for Dinner, Party - Bulk Pack with Microwavable, White",N/A,N/A,9,N/A
"Fun Express Classic Red & Blue Bandana Paper Dessert Plates - 7"" (Pack of 8) - Perfect for Parties & Events",5.0,4,3,N/A
