name,rating,total_reviews,price,buyers
Talking Tables Mermaid Themed Strong Disposable Paper Plates Recyclable Eco-Friendly Kids Birthday Party Tableware Decorations Under the Sea Celebrations or Baby Shower | 8-Pack,4.1,46,7,N/A
"Solo HP9S-2050 9 in White Paper Plate, Heavy Weight (Case of 500)",4.3,2,65,N/A
"Paper Plates, 100% Compostable-[10 Inch by 0.5"" deep]-Heavy Duty Disposable Plate - (BPI Certified) - (PFAS-Free) - Eco-Friendly, Biodegradable Bagasse 10"" Dinner Plates (165 Pack)",4.7,147,29,N/A
brheez Palm Leaf Party Plates 50 Ct 12 Inch Eco Friendly Compostable Biodegradable Elegant Bamboo Look Disposable Party Plates Heavy Duty More Environmentally Friendlier Then Paper Plates,N/A,N/A,47,N/A
"Go-Green 100% Compostable Disposable Paper Plates,Small Paper Plates 6 Inch,Natural Biodegradable Heavyduty Sugarcane Plates for All Occasions Soak Cut Proof, Microwaveable",4.7,133,15,N/A
brheez Palm Leaf Bowls 200 Pack - 4 inch Eco Friendly Compostable & Biodegradable – Elegant Bamboo Look Disposable Bowls are Heavy Duty and More Environmentally Friendly than Paper Bowls,4.5,739,69,N/A
"10"" SQUARE Palm Leaf plate / 100-ct case",4.4,46,74,N/A
brheez Palm Leaf Party Plates 50 Pack - 6 Inch Eco Friendly Compostable & Biodegradable – Elegant Bamboo Look Disposable Party Plates Heavy Duty Environmentally Friendlier than Paper Plates,N/A,N/A,33,N/A
"Palm Naki Oval Palm Leaf Platter - Compostable Oval Plates, BPA Free Plates, Disposable Platter, Eco Friendly Plates (40 Pack of 13”x10” Oval Eco Plates)",5.0,3,39,N/A
"ECO SOUL 100% Compostable 6 Inch Small Paper Plates (125-Pack) Disposable Party Heavy Duty, Eco-Friendly, Appetizer, Dessert, Wedding Plates I Biodegradable Unbleached Sugarcane Eco Plates",4.6,1901,18,100+
100% Compostable Knives - 140 Large Disposable Utensils (7 in.) Eco Friendly Durable and Heat Resistant Alternative to Plastic Knives with Convenient Tray,4.7,191,26,500+
"Chic Leaf Disposable Palm Leaf Plates 7 Inch Bamboo Plates Round (50 count) | Eco Friendly Plates for Weddings and Party | Sturdy, Compostable and Biodegradable Alternative to Paper and Plastic",4.5,432,33,50+
"150PCS 100% Compostable Paper Plates(10 in), Heavy Duty Disposable Plates, Eco Friendly Dinner Plates, Biodegradable Plates Made of Sugarcane Fiber",4.7,266,30,300+
"ECO PRODUCTS Compostable 10"" Paper Plates, Case of 500, Disposable White Molded Fiber, Round, Tree-Free, Stronger Than Paper & Styrofoam, Renewable Molded Natural Fibers",4.2,16,74,N/A
"Talking Tables Mermaid Party Decorations and Tableware 50pcs Bundle Includes Happy Birthday Reusable Bunting, 16 x Napkins, Cups, Paper Plates, Disposable Table cover Under the Sea-Themed",4.8,29,24,N/A
"Amscan Love and Leaves Square Metallic Plates, 7"" (8-Pack) - Dazzling & Elegant Party Plates, Perfect for Wedding, Dinner Party, or Holiday Celebration",4.7,18,7,N/A
"ECO PRODUCTS Vanguard Compostable Disposable Paper Plates, 6"" Square Eco-Friendly Plates, BPI-Certified, No-Added PFAS, White, Pack of 50",N/A,N/A,21,N/A
brheez Palm Leaf Plates 50 Pack - 9 Inch - Eco Friendly Compostable & Biodegradable Elegant Bamboo Look Disposable Party Plates are Heavy Duty and More Environmentally Friendly than Paper Plates,N/A,N/A,37,N/A
"SIMOND STORE Paper Plates 11 Inch - [Pack of 50] - 4 Compartment Disposable 100% Compostable Plates - Heavy Duty - Sugarcane Bagasse Fiber Biodegradable Plates for Party, BBQ, Wedding",5.0,1,32,N/A
"Party Dinnerware Eco Set - 100 Disposable 10"" Square Palm Leaf Plates, 100 Wood Forks, 100 Wood Knives",4.6,62,60,N/A
Solo 8PSC-2050 8.25 in Ivory Bagasse Plate (Case of 500),2.4,12,68,N/A
"Paper Plates, Compostable Heavy Duty Disposable 10 Inch Dinner Plate - (125-Pack)- (PFAS-Free) - (BPI Certified)-Eco-Friendly, Biodegradable Bagasse Natural Brown 10"""" in, BG-10P125",5.0,4,19,N/A
"Dtocs Palm Leaf Plates 7 Inch Square (100) | Bamboo Plates Disposable Look Cocktail Plates for Appetizers, Camping, Dessert, Mini Charcuterie Boards | Compostable Plates Alternate to 7"" Paper Plates",5.0,5,55,N/A
"Sophistiplate Beautiful NEW Wavy Eco-Friendly Compostable Dinner Plates - Made of Bamboo Wood Fiber, and Sugarcane- biodegradable - 9.5 In, Sturdy & Heavy Duty - Pack of 8, Color Sky Blue",4.1,3,16,N/A
Premium Paper Plates Disposable Large Heavy Duty 100% Compostable [100 Count] Oval 12.5x10x1 inch Deep White,4.7,124,22,N/A
"Biodegradable Bagasse Plates - 100pc Dinner Plates Disposable Round Plates, 7 and 10 Inch Combo Pack",4.3,33,10,N/A
"Upper Midland Products 250Ct Compostable Disposable Plates Set, 7 In Heavy Duty Paper Plates, Biodegradable Plates Super Eco Friendly Paper Plate",4.3,31,28,N/A
"100% Compostable Disposable Paper Plates [10"" 20 Pack], Bamboo Plates, Eco Friendly, Biodegradable, Sturdy Large Dinner Party Plates, Heavy-Duty, Unbleached by Earth's Natural Alternative",4.6,99,24,N/A
"[100 COUNT]Harvest Pack PFAS FREE 6.5-inch American Flag Patriotic Party Disposable Compostable Square Paper Plates, July Fourth Natural Bagasse Square Plates, From Eco-Friendly Sugarcane Plant Fibers",4.7,178,21,N/A
"Progressive International Prep Solutions Microwave Plates, 2 Piece Set, White",4.1,93,11,N/A
"Palm Leaf Plates - 6 Inch. Round Bamboo Like Disposable Plates, Eco Friendly Dinner Party Plates - Plastic and Wooden Plates Nice Compostable Alternative - Biodegradable Plates (25 Pack)",4.6,203,20,N/A
"Square Compostable Natural Palm Leaf Plates - Biodegradable, Disposable, Like Bamboo Plates - Eco Friendly Plates, Perfect for Parties, Weddings, and Events, 20 Pack - 10 Inch",4.3,69,15,N/A
Vibrant Birthday Cheer Multicolor Paper Dinner Plates,4.1,16,6,N/A
"BOOBAM ECONATURAL PRODUCTS Square Disposable Plates - Plant-Based Bagasse Compostable Serving Plates for Party, Birthday, Wedding, Dessert - Microwavable Eco-Conscious Dinnerware - 6 inches (50-Pack)",3.6,30,22,N/A
100% Compostable 9 Inch Paper Plates [150-Pack] Disposable Party Plates I Heavy Duty Eco-Friendly Dinner Plates I Biodegradable Unbleached Sugarcane Eco Plates - (Color - Nature),4.9,10,22,N/A
"Glad Compostable Paper Plates| 9-in Round Plates | Eco Plates, Sugarcane Disposable Plates, Compostable Microwavable & Freezer Safe, Eco-Friendly Plates| White Paper Plates, 20 Count - 6 Pack",4.6,216,29,N/A
Restaurantware Midori 6.3 x 4.7 Inch Square Palm Plates 100 Microwavable Palm Leaf Plates - Freezable Sustainable Areca Palm Leaf Plates Oven-Ready For Hot & Cold Foods,4.6,3,21,N/A
"300 8"" ECONLY Disposable party pack| Square Palm Leaf Plates100 + 200Cutlery(Forks,Knives) Better Than Bamboo or Wood Plates. Heavy Duty,100%Compostable,Biodegradable Eco Plates for BBQs Camping Party",N/A,N/A,67,N/A
"brheez Palm Leaf Bowls 6 Inch - 50 Count - Eco Friendly, Compostable & Biodegradable – Elegant Bamboo Look Disposable Bowls are Heavy Duty and More Environmentally Friendly than Paper Bowls",N/A,N/A,33,N/A
100% Compostable 10/3 CP Round Plates [125 Pack] Disposable Party Plates I Heavy Duty Eco-Friendly Dinner Plates Disposable I Biodegradable Unbleached Sugarcane Eco Plates - (Color - White),5.0,3,18,N/A
"Efavormart 25 Pack | 7"" Tropical Palm Leaf Mix Dessert Disposable Paper Plates - 300 GSM",4.5,30,5,N/A
"9 inch Round Disposable White Bagasse Dinner Plate, 100% Compostable Natural Sugarcane Fibers, Heavy Duty Leak-Proof Environmentaly Friendly, Biodegradable - 125 Count",4.5,104,29,N/A
"Rectangle Palm Leaf Plates Set | 50 Pack | Size - 9 x 6 inches | Ecofriendly Disposable Dinnerware | Heavy Duty Biodegradable Party Utensils for Wedding, Camping & More",4.3,122,29,N/A
Cakewalk (Party) 6481 Monstera Appetizer Disposable Plates,5.0,4,7,N/A
"Eco-Friendly Compostable Party Plates - Set of 50 Disposable Wooden Dessert Plates (7.5"" x 5.5"") for Events and Gatherings",4.2,102,24,N/A
"Dtocs Palm Leaf Plates 10 Inch Round 3 Compartment (Pack 25) | Bamboo Look Organic, Eco-Friendly, Biodegradable, Compostable Disposable Dinnerware Set For Camping, Birthday Party",5.0,3,34,N/A
"Dtocs Palm Leaf Plates 6 Inch Round (50) | Bamboo Plates Disposable Look Cocktail Plates for Appetizers, Dessert Plates, Mini Charcuterie Boards | Shallow Compostable Plates Alternate to Paper Plates",4.6,4,26,N/A
"Highmark Disposable 6 3/4in. Plates, Pack Of 125, 11579",5.0,1,14,N/A
PacknWood 210BCHIC180 - Square Disposable Dinner Plates - Heavy-Duty Plates - Microwaveable Sugarcane Compostable 100% Natural - Bio n Chic White Sugarcane Plate - 7 x 7in - 100 pcs,3.4,10,52,N/A
"POPMISOLER 125PCS Premium 9-Inch Paper Plates - Eco-Friendly, Sugarcane Plates,Recyclable Plates,Bamboo Bowls Disposable,Lightweight, and Durable - Perfect for Parties and Events (500)",N/A,N/A,55,N/A
"Biodegradable Paper Plates - 9 Inch Heavy Duty, Eco Friendly Disposable Plates Made with Sugarcane Bagasse. Strong, Durable and Microwave Safe - (100 Pack, Bulk) (100, 9 Inch)",4.6,6,21,N/A
"Sophistiplate Beautiful NEW Wavy Eco-Friendly Compostable Salad Plates - Made of Bamboo Wood Fiber, and Sugarcane- biodegradable - 7.5 In, Sturdy & Heavy Duty - Pack of 8, Color Blush",N/A,N/A,13,N/A
"Raj Eco Compostable Palm Leaf Plates Like Bamboo Plates Disposable - 10 and 7 Inch Square 50 Party Plates, Natural Wooden, Eco-Friendly, Fancy Biodegradable Dessert Appetizer Wedding Plates",3.0,2,55,N/A
"Hot Wheels Wild Racer Round Plates (9"", 6 Packs of 8) - Vibrant Multicolor Paper Party Plates - Ideal for Kids Birthday or Hot Wheels Themed Celebrations - 48 Pc.",N/A,N/A,36,N/A
"Disposable Palm Leaf 5""x7"" Oval Plates (25 pcs) | Wooden Bamboo Plate | Compostable Plates for Any Parties, Wedding Party, Charcuterie Plate | Alternative to Plastic & Paper Plates",4.5,6,16,N/A
"Efavormart 25 Pack | 7"" Green Leaf Decagon Dessert Paper Plates, Appetizer Plates, Disposable Party Plates",4.5,7,5,N/A
"10 Pcs Star Gold Paper Plates, 7 Inch Pentagram Disposable Paper Plates Dinnerware for Christmas Halloween Dinner Wedding Birthday Picnic Appetizers Fruit Dessert Decorations Tableware Supplies",3.0,5,9,N/A
"Sophistiplate Beautiful NEW Wavy Eco-Friendly Compostable Salad Plates - Made of Bamboo Wood Fiber, and Sugarcane- biodegradable - 7.5 In, Sturdy & Heavy Duty - Pack of 8, Color Berry",4.0,1,13,N/A
"Key West Metallic Square Paper Plates - 7"" (Pack of 8) - Stylish Tropical Tableware, Perfect for Luau, Tiki, Hawaiian, Pool, and Cocktail Parties",5.0,1,25,N/A
"Sophistiplate Beautiful NEW Wavy Eco-Friendly Compostable Dinner Plates - Made of Bamboo Wood Fiber, and Sugarcane- biodegradable - 9.5 In, Sturdy & Heavy Duty - Pack of 8, Color Blush",5.0,1,16,N/A
"ECO PRODUCTS Compostable 3 Compartment 10"" Paper Plates, Case of 500, Disposable White Molded Fiber, Round, Tree-Free, Stronger Than Paper & Styrofoam, Renewable Molded Natural Fibers",3.7,3,114,N/A
Chic Leaf Palm Leaf Plates Disposable Bamboo Plates Like 10 Inch Square Bulk Pack (100 ct),4.6,1296,47,100+
"Chic Leaf Palm Leaf Plates Disposable Bamboo Plates Like 10 Inch & 7 Inch Round Party Pack (48 pk) Compostable and Biodegradable - Better than Plastic, Paper and Wood Plates",4.5,432,41,200+
"100% Compostable Disposable Paper Plates Bulk [6"" 125 Pack], Bamboo Plates, Eco Friendly, Biodegradable, Sturdy Small Dessert Party Plates, Heavy-Duty, Unbleached by Earth's Natural Alternative",4.7,10635,11,200+
100% Compostable Paper Plates [9 in.] – 150 Disposable Plates Eco Friendly Sturdy Tree Free Liquid and Heat Resistant Alternative to Plastic or Paper Plates,4.6,385,36,1000
Restaurantware Indo 9.3 x 9.3 Inch Square Palm Plates 100 Microwavable Palm Leaf Dinner Plates - Freezable Sustainable Areca Palm Leaf Plates Oven-Ready For Hot & Cold Foods,4.4,15,80,N/A
"Animal Dessert Paper Plates Birthday Party Decorations,Jungle Theme Party Supplies Include Plates, Napkin and Cutlery,Perfect for Themed Events,Disposable Dishes for Kids Eco Choice",5.0,1,17,N/A
"16 OZ Paper Bowls, Premium Disposable Bowls - Sturdy and Eco-Friendly Party Bowls, Heavy Duty Biodegradable Bamboo Dinner Bowls I Biodegradable Unbleached Sugarcane Eco Bowls - 125 PCs",4.5,2,22,N/A
"Dart OFMP6J7234 Bare Paper Eco-Forward Dinnerware, 6"" Plate, Green/Tan (Case of 500)",N/A,N/A,76,N/A
"Pale Pink Value Round Paper Plates - 9"" (Pack Of 16) - Durable & Eco-Friendly Disposable Party Plates",1.0,1,6,N/A
"PACKNWOOD 210BCHIC90180 Heavy-Duty Biodegradable Sugarcane Plates - Disposable Rectangular Plates - Microwavable - Oven Safe - Biodegradable, and compostable Plate - 3.5 x 7.1in - 100 pcs",3.2,3,24,N/A
"CaterEco Rectangle Palm Leaf Plates Set (Pack of 150)|Ecofriendly Disposable Dinnerware | Heavy Duty Biodegradable Party Utensils for Wedding, Camping & More",4.5,2,84,N/A
"Dtocs Palm Leaf Plates 5x8 Inch Rectangle (Pack 100) | Organic, Eco-Friendly, Biodegradable, Compostable Disposable Dinnerware Set For Wedding, Camping, Birthday Party- Natural Bamboo, Wooden Texture",N/A,N/A,47,N/A
"Disposable Palm Leaf 6""x5"" Rectangle Deep Plates (25 pcs) | Wooden Bamboo Plates | Compostable Plates for Parties, Wedding Party | Alternative to Plastic & Paper Plates",4.5,59,18,N/A
"Dtocs Palm Leaf Plates 7 Inch Round (50) | Bamboo Plates Disposable Look Cocktail Plates for Appetizer, Dessert Plates, Mini Charcuterie Boards | Compostable Plates Alternate to Wooden Paper Plates",4.4,2,49,N/A
"200 Pack of 7x5"" Oval Disposable Palm Leaf Plates Set - Sturdy & Elegant - Camping Party Home Use - Biodegradable & Compostable - by Eko Future",4.4,259,117,N/A
"Deluxe Round Pure Palm Leaf Plates Set | (Pack of 25) 7"" Salad Plates | Ecofriendly Disposable Dinnerware | Heavy Duty Biodegradable Party Utensils for Wedding, Camping & More",4.1,21,33,N/A
"9 Inch Disposable Bamboo Paper Plates - 100 Pack Heavy Duty, Biodegradable, Compostable Large Serving Plate for Dinner, Party - Bulk Pack with Microwavable, White",N/A,N/A,18,N/A
"Repurpose, 9"" Eco-Dinner Plates, 20 Count",4.4,396,4,100+
"Efavormart 50 Pcs Marble/Gold Dinner & Dessert/Appetizer Paper Plate Pack, Disposable Plates - 25 Guest Set",3.9,6,9,N/A
"PacknWood 210BCHICDROP Paper plates with compartments -eco friendly paper plates,oval disposable plates - Drop Shaped White Sugarcane Dish (0.5 oz, 4.1"" x 1.9"") - 300 pcs",5.0,2,68,N/A
"Ecoplates 6-Inch Compostable Paper Plates -Bulk [Count 1000], Made from Sugarcane Fiber 100% Biodegradable,Dessert Plates-Heavy Duty-Eco Friendly-[ Case 20/50 Pack Each ] Bagasse Disposable Plates.",N/A,N/A,52,N/A
SOLO Cup Company OFMP9J7234 Bare Paper Eco-Forward Dinnerware 8 1/2-Inch Plate Green/Tan 250/Carton,1.0,1,9,N/A
JAM PAPER Round Paper Party Plates - Small - 7 Inch - White - 50/pack,4.4,48,11,N/A
"The Palms Bamboo Palm Leaf Plates, 25 Count, 10 Inch Square for Appetizers, Birthday Cake, BBQ, Dinner or Camping, Rustic Natural Dishware, Biodegradable Compostable",4.8,17,29,N/A
Restaurantware Pulp Tek 7.9 Inch Eco-Friendly Plates 100 Medium Plates - Made From Natural Sugarcane Fibers Heavy-Duty White Bagasse Premium Plates For Appetizers Entrees Or Desserts Square,4.2,33,55,N/A
"100% Compostable Square Paper Plates, Disposable Paper Plates 8 inch for Party (500 Count), Heavy Duty Paper Dinner Plates, Dessert Plates, Made from Sugarcane ＆ Bamboo Fibers",4.8,23,74,N/A
"Dtocs Palm Leaf Plate Set (100 Pcs) Oval Plates 7x5 Inch | Disposable Bamboo Plate Like Compostable Dinnerware Set Sturdy Than Paper Plates | Designer Plates for Serving Dessert, Cake, Salad",5.0,4,55,N/A
"10-Inch Compostable 3-Compartment Paper Plates | Heavy Duty Biodegradable Bagasse Lunch Trays | PFAS Free, BPA Certified, Disposable Sectional Trays (100)",5.0,1,18,N/A
"Emerald 100% Tree Free Sugarcane Heavy Duty Plate, 9 Inches, 300 Count",3.5,17,37,N/A
"By The Sea Dessert Paper Plates Disposable ECO Party Tableware, Round, 7"", Pack of 8.",2.0,1,8,N/A
"Dart Bare Paper Eco-Forward Dinnerware, 8 1/2"" Plate, Green/tan, 250/carton",N/A,N/A,51,N/A
"ECO PRODUCTS Compostable 10"" Oval Paper Plates, Case of 500, Disposable White Molded Fiber, Tree-Free, Stronger Than Paper & Styrofoam, Renewable Molded Natural Fibers",N/A,N/A,24,N/A
"Dart Bare Eco-Forward Clay-Coated Paper Dinnerware, Plate, 8 1/2"" dia, 500/Carton",5.0,1,105,N/A
"Yamato Bussan Disposable Tableware, White, 7.1 inches (18 cm), Eco Paper Plate, Pack of 10",N/A,N/A,14,N/A
SOLO Cup Company OFMP6J7234 Bare Paper Eco-Forward Dinnerware 6-Inch Plate Green/Tan 500/Carton,N/A,N/A,102,N/A
"Dart Bare Eco-Forward Clay-Coated Paper Dinnerware, Plate, 9"" Diameter, White",N/A,N/A,81,N/A
"Solo Cup Bare Eco-Forward Clay-Coated Paper Plate, 9"", White, Round,",N/A,N/A,82,N/A
"SCCHP9S - Solo Bare Eco-Forward Clay-Coated Paper Dinnerware, Plate, 9amp;quot; Diameter, White",N/A,N/A,87,N/A
"Dart OFMP9R-J7234 Bare Paper Eco-forward Dinnerware, 8 1/2 Plate, Green/tan, 250/carton",N/A,N/A,65,N/A
ECO Cardboard Paper Plates Diameter 18 cm Pack of 10 Made from 100% Biodegradable raw Materials Printed with Water-Based Inks Subtle Patterns for Little Ones.,5.0,3,14,N/A
Ginger Ray Natural Marble Eco Paper Party Plates - 8 Pack,5.0,1,14,N/A
"SOLIA VO57022 Au Gratin Dishes, Disposable Tableware, 1.7 fl oz (50 ml), Paper Plates, Eco Material, Pulp, French Cuisine",N/A,N/A,21,N/A
"ECO PRODUCTS Compostable Disposable Paper Plates, 10"" Round Eco-Friendly Molded Fiber Plates, Grease & Cut Resistant, White, Pack of 50",N/A,N/A,25,N/A
"300 Pieces 100% Compostable Paper Plates (White 7inch+9inch) Heavy Duty Disposable Plates Eco Plates Made of Sugarcane Fiber Biodegradable Plates for Everyday Dinner, Party, Barbecue",N/A,N/A,,N/A
"300 Pieces 100% Compostable Paper Plates (White 150pieces7inch+150piece10inch) Heavy Duty Disposable Plates Eco Plates Made of Sugarcane Fiber Biodegradable Plates for Everyday Dinner, Party, Barbecue",N/A,N/A,,N/A
"300 Pieces 100% Compostable Paper Plates (White 150pieces10inch+150piece10inch) Heavy Duty Disposable Plates Eco Plates Made of Sugarcane Fiber Biodegradable Plates for Everyday Dinner, Party, Barbecu",N/A,N/A,,N/A
Ginger Ray Eco Paper Party Colourful Rainbow Paper Happy Birthday Plates - Pack of 8,N/A,N/A,11,N/A
"Disposable Dishes Plates Natural Biodegradable Plates, dinnerware,Party|100% Biodegradable_Eco Friendly_12 Inch Paper Dinner Plates_Pack of 50_Natural Paper Plates",N/A,N/A,23,N/A
"Disposable Dishes Plates Natural Biodegradable Plates, dinnerware,Party|100% Biodegradable_Eco Friendly_12 Inch Paper Dinner Plates_Pack of 50_Natural Paper Plates",N/A,N/A,23,N/A
"Disposable Dishes Plates Natural Biodegradable Plates, dinnerware,Party|100% Biodegradable_Eco Friendly_12 Inch Paper Dinner Plates_Pack of 50_Natural Paper Plates",N/A,N/A,32,N/A
"Shinwa EC-501 Eco Cook Round Plate, 7.1 inches (18 cm), Set of 8, White",N/A,N/A,0,N/A
"Bare Eco-Forward Clay-Coated Paper Dinnerware, Bowl, 12oz, 125/bag, 8/ct",N/A,N/A,43,N/A
Chic Leaf Palm Leaf Plates Disposable Bamboo Plates Like 10 Inch Square (50 Pc) - 100% Compostable Plates Perfect For Wedding and Party Entrees - Better than Plastic and Paper Plates,4.6,1296,37,200+
Chic Leaf 100% Compostable Disposable Palm Leaf Plates 6 Inch Like Bamboo Plates Round (50 pc) - Premium Appetizer Plates for Wedding and Party Events - Sturdy Eco Friendly Disposable Plates,4.3,72,28,N/A
"ECO SOUL 100% Compostable 10 Inch Paper Plates [100-Pack] Disposable Party Plates I Heavy Duty Eco-Friendly Sturdy Dinner, Wedding, Event Plates I Biodegradable Unbleached Sugarcane Eco Plates",4.6,1901,23,700+
"Chic Leaf Palm Leaf Disposable Plates - Square Bamboo Plates 100 Pack 10"" and 7"" - Compostable & Biodegradable, Better than Plastic Plates - Heavy-Duty Dinnerware set for Parties, Weddings, Appetizers",4.5,2112,50,700+
"Disposable Dishes Plates Natural Biodegradable Plates, dinnerware,Party|100% Biodegradable_Eco Friendly_12 Inch Paper Dinner Plates_Pack of 50_Natural Paper Plates",N/A,N/A,34,N/A
"Disposable Dishes Plates Natural Biodegradable Plates, dinnerware,Party|100% Biodegradable_Eco Friendly_12 Inch Paper Dinner Plates_Pack of 50_Natural Paper Plates",N/A,N/A,22,N/A
"Shinwa EC-501 Eco Cook Round Plate, 7.1 inches (18 cm), Set of 8, White",N/A,N/A,0,N/A
"Bare Eco-Forward Clay-Coated Paper Dinnerware, Bowl, 12oz, 125/bag, 8/ct",N/A,N/A,43,N/A
"amscan Round Birthday Eco Paper Plates with Polka Dots and Cupcake Design-8pcs, Multicolor, 40g",4.3,3,23,N/A
"Disposable Dishes Plates Natural Biodegradable Plates, dinnerware,Party|100% Biodegradable_Eco Friendly_12 Inch Paper Dinner Plates_Pack of 50_Natural Paper Plates",N/A,N/A,23,N/A
"Disposable Dishes Plates Natural Biodegradable Plates, dinnerware,Party|100% Biodegradable_Eco Friendly_12 Inch Paper Dinner Plates_Pack of 50_Natural Paper Plates",N/A,N/A,23,N/A
"Disposable Dishes Plates Natural Biodegradable Plates, dinnerware,Party|100% Biodegradable_Eco Friendly_12 Inch Paper Dinner Plates_Pack of 50_Natural Paper Plates",N/A,N/A,23,N/A
"Disposable Dishes Plates Natural Biodegradable Plates, dinnerware,Party|100% Biodegradable_Eco Friendly_12 Inch Paper Dinner Plates_Pack of 50_Natural Paper Plates",N/A,N/A,32,N/A
"Paw Paper Plates (23 cm) I Pack of 10 I Disposable Plates Colourful Made of Cardboard I Ideal for Weddings, Communions, Parties, Birthdays I Printed with Water-based Colours I Colour: BBQ Party",3.3,5,26,N/A
PacknWood Eco-Design White Sugarcane Plate | Heavy Duty Paper Plates | Eco Friendly Compostable Sugarcane Plates | 100% Biodegradable Sturdy- 500 pcs,N/A,N/A,154,N/A
PacknWood Eco-Design White Sugarcane Plate | Heavy Duty Paper Plates | Eco Friendly Sugarcane Plates | 100% Biodegradable Sturdy- 15oz - 500 pcs,N/A,N/A,166,N/A
"100% Compostable Paper Plates, Heavy Duty Disposable Plates [Pack of - 150] 7"" Round Plate-Eco-Friendly, Biodegradable Sugarcane Bagasse, Natural Unbleached white 7"" Dinner Paper Plate Disposable",N/A,N/A,18,N/A
"Disposable Dishes Plates Natural Biodegradable Plates, dinnerware,Party|100% Biodegradable_Eco Friendly_12 Inch Paper Dinner Plates_Pack of 50_Natural Paper Plates",N/A,N/A,23,N/A
"Disposable Dishes Plates Natural Biodegradable Plates, dinnerware,Party|100% Biodegradable_Eco Friendly_12 Inch Paper Dinner Plates_Pack of 50_Natural Paper Plates",N/A,N/A,23,N/A
"Disposable Dishes Plates Natural Biodegradable Plates, dinnerware,Party|100% Biodegradable_Eco Friendly_ 8 Inch Paper Tiffin Plates_Pack of_Natural Paper Tiffin Plates (300)",N/A,N/A,23,N/A
"Disposable Dishes Plates Natural Biodegradable Plates, dinnerware,Party|100% Biodegradable_Eco Friendly_12 Inch Paper Dinner Plates_Pack of 50_Natural Paper Plates",N/A,N/A,23,N/A
"SIMOND STORE - Paper Plates 12 Inch - [Pack of 125] Disposable 100% Compostable Plates - Heavy Duty -Sugarcane Bagasse Fiber Biodegradable Large Dinner Plates for Party, BBQ, Wedding",N/A,N/A,46,N/A
"SIMOND STORE - Small Paper Plates 6 Inch - [Pack of 500] Dessert Compostable Plates - Heavy Duty Disposable Plates - Sugarcane Bagasse Fiber Biodegradable Plates for Party, BBQ, Wedding",N/A,N/A,41,N/A
"Eco-Products EPP013 Renewable & Compostable Sugarcane Plates, 9-Inch, 500/Carton",N/A,N/A,24,N/A
Eco Stix Palm Plates. Pack of 25 CT. 10 Inches Square,N/A,N/A,16,N/A
"Dart OFHW12J7234 Bare Paper Eco-Forward Dinnerware, 12oz Bowl, Green/Tan (Case of 500)",N/A,N/A,23,N/A
AKOAK 4 Styles 20 Count Pink Series Disposable Tableware Party Paper Plates Cups Baby Shower Favor Paper Party Dinnerware,N/A,N/A,9,N/A
Zebra Square Dinner Plate - ECO,N/A,N/A,136,N/A
PacknWood 210ECOD2614 - Heavy-Duty Biodegradable Sugarcane Plates - Eco-Design White Sugarcane Plate - Disposable Rectangular Plates - Microwavable - Oven Safe - 10.25 x 5.12 x 1.1in - 500 pcs,N/A,N/A,125,N/A
"Square Party 9"" | Multicolor | Bella Vite Collection | Pack of 12 Paper, 9 inch Plate",3.0,1,10,N/A
"100 Pack Paper Plates - Uncoated White Plate - Use for Foodware, Events, Activities, Crafts Projects and More - Environmentally Friendly - Recyclable and Disposable",N/A,N/A,11,N/A
"10"" Evo Eco Square Palm Leaf Plates Dinner Plates Lunch Plates | Eco friendly Disposable Dinnerware | Heavy Duty Biodegradable Party Plates for Wedding, Camping Parties & More 100 pack By Evo Eco",5.0,1,58,N/A
"Yamato Bussan Paper Plate, Eco Paper, Mini Donburi, 6.8 fl oz (200 ml), 30 Sheets",N/A,N/A,23,N/A
"Eco-Products EP-P016PK Renewable and Compostable Sugarcane Plate Convenience Pack, 6"" Diameter, Round, Natural White, Bagasse (Pack of 1000)",N/A,N/A,66,N/A
"10"" Evo-Eco 10 Inch Square Palm Leaf Plates Dinner Plates Lunch Plates Eco friendly Disposable Dinnerware | Heavy Duty Biodegradable Party Plates for Wedding, Camping Parties & More 100pack By Evo Eco",5.0,1,39,N/A
"ECO PRODUCTS Disposable Rectangular Sugarcane Plate, Eco-Friendly, Compostable, Grease and Cut Resistant, Microwave Safe, 10"" x 5"", Case of 500",N/A,N/A,130,N/A
"Asean ECO SOURCE 10"" DI COMPOSTABLE TABLEWARE ROUND PLATE, (500/cs)",N/A,N/A,81,N/A
"Evo Eco 10"" Palm Leaf Plates Dinner Plates Lunch & Breakfast plates | Eco friendly Disposable Dinnerware | Heavy Duty Biodegradable Party Plates for Wedding, Camping Parties & More 50 pack By Evo Eco",5.0,1,39,N/A
"10"" [200] Disposable Palm Leaf Plates Round |Compostable Biodegradable Eco Party Plates Heavy Duty Eco Friendly Bamboo Looking Camping,Wedding, Event Plates",5.0,1,119,N/A
"Atyhao Dinner Plate, Carrot Shape Cartoon Pictures Paper Plate Degradable for Parties",N/A,N/A,8,N/A
"Greenovation Palm Leaf Plates – 25pcs | Eco-Friendly Plates Made of Fallen Areca Palm Leaves – Compostable and Biodegradable Plates – Sturdy Serving Plates for Parties, Dinner – 8"" Elegant Square (25)",N/A,N/A,22,N/A
"120 pc 7"" Everyday Sturdy Sugarcane Bagasse Plate 100% compostable in 90 days",5.0,1,23,N/A
"Bagasse 10"" Round Plate, Compostable White, 500/case",N/A,N/A,23,N/A
"EconoHome Compostable Paper Plates 9 inch [125-Pack] & Clamshell Take Out Food Containers [6x6 50-Pack] - Made of Bagasse, Sugarcane Fiber - Microwave, Refrigerator-Safe",N/A,N/A,,N/A
